{
  "schema": "io.github.fixz.apkesu.theme-creators",
  "version": 1,
  "generatedAt": 1784879146817,
  "reviewer": "fixz232",
  "creators": [
    {
      "github": "fixz232",
      "displayName": "fixz232",
      "approvedAt": 0,
      "status": "approved"
    },
    {
      "github": "wjn-boop",
      "displayName": "wjn",
      "approvedAt": 1784879146817,
      "status": "approved"
    }
  ]
}
